{
  "contract_version": "stylematch.style-vision-embedding.v1",
  "catalog_version": "stylematch.style-catalog.v1",
  "model": {
    "provider": "openai",
    "model_id": "openai/clip-vit-large-patch14",
    "revision": "32bd64288804d66eefd0ccbe215aa642df71cc41",
    "architecture": "CLIP ViT-L/14",
    "embedding_dimensions": 768,
    "weights_sha256": "a2bf730a0c7debf160f7a6b50b3aaf3703e7e88ac73de7a314903141db026dcb",
    "local_path": "C:/Users/Kevin/Documents/ComfyUI/models/clip_vision/openai-clip-vit-large-patch14"
  },
  "similarity": {
    "normalization": "l2",
    "metric": "cosine",
    "temperature": 0.07,
    "top_k": 3,
    "automatic_acceptance_threshold": 0.62,
    "minimum_margin": 0.08,
    "requires_human_confirmation": true
  },
  "prompt_template": "a professional interior design photograph of {description}, no people, no text",
  "styles": [
    { "id": "modern", "name": "現代風", "description": "a modern interior with clean lines, open layout, neutral colors and warm wood" },
    { "id": "scandinavian", "name": "北歐風", "description": "a Scandinavian interior with daylight, pale wood, soft textiles and functional furniture" },
    { "id": "minimalist", "name": "極簡風", "description": "a minimalist interior with precise proportions, seamless surfaces and concealed storage" },
    { "id": "industrial", "name": "工業風", "description": "an industrial loft with exposed concrete, black steel, brick and aged timber" },
    { "id": "cream", "name": "奶油風", "description": "a cream style interior with warm ivory colors, soft curves and tactile fabrics" },
    { "id": "light_luxury", "name": "輕奢風", "description": "a light luxury interior with refined marble, champagne metal and tailored furniture" },
    { "id": "neoclassical", "name": "新古典風", "description": "a neoclassical interior with balanced symmetry, elegant moulding, stone and brass" },
    { "id": "british", "name": "英式風格", "description": "a British interior with dark timber, leather, plaid textiles and library atmosphere" },
    { "id": "chinese_classic", "name": "中式古典風", "description": "a classical Chinese interior with axial symmetry, timber lattice and refined joinery" },
    { "id": "european_classic", "name": "歐式古典風", "description": "a European classical interior with formal symmetry, ornate mouldings and crystal lighting" },
    { "id": "art_deco", "name": "裝飾藝術風", "description": "an Art Deco interior with bold geometry, black, brass, polished stone and velvet" },
    { "id": "wabi_sabi", "name": "侘寂風", "description": "a wabi-sabi interior with imperfect plaster, aged wood, natural stone and quiet shadows" },
    { "id": "new_oriental", "name": "新東方風", "description": "a new oriental interior with contemporary Asian restraint, framed views and timber screens" },
    { "id": "humanistic", "name": "人文風", "description": "a humanistic interior with warm timber, books, art collection and tactile craft" },
    { "id": "japanese", "name": "日式風", "description": "a Japanese interior with low furniture, natural timber, shoji screens and serene daylight" },
    { "id": "tropical", "name": "南洋風", "description": "a tropical Southeast Asian interior with rattan, teak, lush plants and breezy layout" },
    { "id": "provence", "name": "南法風", "description": "a Provence interior with sun-washed plaster, distressed wood, linen, lavender and sage" },
    { "id": "country", "name": "鄉村風", "description": "a country interior with solid wood, farmhouse details and comfortable family textiles" },
    { "id": "american", "name": "美式風格", "description": "an American interior with generous proportions, upholstered furniture and wall panelling" },
    { "id": "bohemian", "name": "波西米亞風", "description": "a bohemian interior with layered artisan textiles, global patterns, rattan and plants" },
    { "id": "biophilic", "name": "綠意自然風", "description": "a biophilic interior with abundant greenery, daylight, timber, stone and outdoor connection" },
    { "id": "futurism", "name": "未來主義風", "description": "a futuristic interior with flowing geometry, smart surfaces, metal and dynamic lighting" },
    { "id": "coastal", "name": "海洋海岸風", "description": "a coastal interior with airy white space, sandy neutrals, ocean blue, linen and weathered wood" },
    { "id": "moroccan", "name": "中東摩洛哥風", "description": "a Moroccan interior with horseshoe arches, zellige tiles and carved metal lanterns" },
    { "id": "resort_villa", "name": "度假別墅風", "description": "a resort villa interior with expansive indoor outdoor living, stone, timber and lush views" },
    { "id": "artistic_eclectic", "name": "藝術混搭風", "description": "an artistic eclectic interior with curated art, mixed eras and controlled color accents" },
    { "id": "chill", "name": "Chill 輕鬆風", "description": "a chill relaxed interior with cafe warmth, casual lounge seating and soft ambient light" },
    { "id": "boutique_hotel", "name": "飯店精品風", "description": "a boutique hotel interior with layered lighting, tailored joinery, stone and leather" },
    { "id": "retro", "name": "復古風", "description": "a retro interior with mid-century furniture, walnut, nostalgic colors, vintage glass and brass" },
    { "id": "gallery", "name": "藝術廊館風", "description": "a gallery interior with clean exhibition walls, precise track lighting and art-centered circulation" }
  ]
}
